{
  "paperId": "english-y12-trial-p2-std-ascham-2021-p2-std",
  "subject": "english",
  "source": "ocr",
  "questions": [
    {
      "number": "1",
      "marks": null,
      "topic": null,
      "module": null,
      "syllabusRefs": [],
      "type": null,
      "stimulus": [
        {
          "page": 1,
          "bbox": [
            0.06,
            0.3999254079254079,
            0.95,
            1.0
          ]
        }
      ],
      "text": "Question 1",
      "parts": [
        {
          "label": "a",
          "marks": null,
          "type": null,
          "regions": [
            {
              "page": 5,
              "bbox": [
                0.06,
                0.37894638694638694,
                0.95,
                0.5019425019425019
              ]
            }
          ],
          "markingRegions": [],
          "text": "(a) MT Anderson, Feed"
        },
        {
          "label": "b",
          "marks": null,
          "type": null,
          "regions": [
            {
              "page": 5,
              "bbox": [
                0.06,
                0.4939425019425019,
                0.95,
                0.6658896658896659
              ]
            }
          ],
          "markingRegions": [],
          "text": "(b) Mark Haddon, The Curious Incident of the Dog in the Night-time"
        },
        {
          "label": "a",
          "marks": null,
          "type": null,
          "regions": [
            {
              "page": 5,
              "bbox": [
                0.06,
                0.6578896658896659,
                0.95,
                1.0
              ]
            }
          ],
          "markingRegions": [],
          "text": "(a) Robert Gray, Coast Road"
        },
        {
          "label": "b",
          "marks": null,
          "type": null,
          "regions": [
            {
              "page": 6,
              "bbox": [
                0.06,
                0.07902408702408703,
                0.95,
                0.43434343434343436
              ]
            }
          ],
          "markingRegions": [],
          "text": "(b) Oodgeroo Noonuccal, Selected Poems"
        },
        {
          "label": "a",
          "marks": null,
          "type": null,
          "regions": [
            {
              "page": 6,
              "bbox": [
                0.06,
                0.42634343434343436,
                0.95,
                0.5975135975135976
              ]
            }
          ],
          "markingRegions": [],
          "text": "(a) Scott Rankin, Namatjira from Namatjira & Ngapartji \u2014 Two plays by Scott Rankin"
        },
        {
          "label": "b",
          "marks": null,
          "type": null,
          "regions": [
            {
              "page": 6,
              "bbox": [
                0.06,
                0.5895135975135976,
                0.95,
                1.0
              ]
            }
          ],
          "markingRegions": [],
          "text": "(b) William Shakespeare, A Midsummer Night\u2019s Dream"
        }
      ]
    }
  ]
}