{
  "paperId": "maths-advanced-y12-trial-newcastle-grammar-2005-w-sol",
  "subject": "maths-advanced",
  "source": "ocr",
  "questions": [
    {
      "number": "1",
      "marks": null,
      "topic": null,
      "module": null,
      "syllabusRefs": [],
      "type": null,
      "marksPrinted": false,
      "stimulus": [],
      "text": "QUESTION 1 Use a SEPARATE Writing Booklet.",
      "parts": [
        {
          "label": null,
          "marks": null,
          "type": null,
          "marksPrinted": false,
          "regions": [
            {
              "page": 1,
              "bbox": [
                0.06,
                0.07131570762052877,
                0.95,
                0.5202177293934681
              ]
            }
          ],
          "markingRegions": [],
          "text": "QUESTION 1 Use a SEPARATE Writing Booklet."
        }
      ]
    },
    {
      "number": "2",
      "marks": null,
      "topic": null,
      "module": null,
      "syllabusRefs": [],
      "type": null,
      "marksPrinted": false,
      "stimulus": [],
      "text": "QUESTION 2 Use a SEPARATE Writing Booklet.",
      "parts": [
        {
          "label": null,
          "marks": null,
          "type": null,
          "marksPrinted": false,
          "regions": [
            {
              "page": 1,
              "bbox": [
                0.06,
                0.5122177293934681,
                0.95,
                1.0
              ]
            }
          ],
          "markingRegions": [],
          "text": "QUESTION 2 Use a SEPARATE Writing Booklet."
        }
      ]
    },
    {
      "number": "3",
      "marks": null,
      "topic": null,
      "module": null,
      "syllabusRefs": [],
      "type": null,
      "marksPrinted": false,
      "stimulus": [],
      "text": "QUESTION 3 Use a SEPARATE Writing Booklet.",
      "parts": [
        {
          "label": null,
          "marks": null,
          "type": null,
          "marksPrinted": false,
          "regions": [
            {
              "page": 2,
              "bbox": [
                0.06,
                0.04798755832037325,
                0.95,
                0.3973561430793157
              ]
            }
          ],
          "markingRegions": [],
          "text": "QUESTION 3 Use a SEPARATE Writing Booklet."
        }
      ]
    },
    {
      "number": "4",
      "marks": null,
      "topic": null,
      "module": null,
      "syllabusRefs": [],
      "type": null,
      "marksPrinted": false,
      "stimulus": [],
      "text": "QUESTION 4 Use a SEPARATE Writing Booklet.",
      "parts": [
        {
          "label": null,
          "marks": null,
          "type": null,
          "marksPrinted": false,
          "regions": [
            {
              "page": 2,
              "bbox": [
                0.06,
                0.3893561430793157,
                0.95,
                1.0
              ]
            }
          ],
          "markingRegions": [],
          "text": "QUESTION 4 Use a SEPARATE Writing Booklet."
        }
      ]
    },
    {
      "number": "5",
      "marks": null,
      "topic": null,
      "module": null,
      "syllabusRefs": [],
      "type": null,
      "marksPrinted": false,
      "stimulus": [],
      "text": "QUESTION 5 Use a SEPARATE Writing Booklet.",
      "parts": [
        {
          "label": null,
          "marks": null,
          "type": null,
          "marksPrinted": false,
          "regions": [
            {
              "page": 3,
              "bbox": [
                0.06,
                0.08297978227060654,
                0.95,
                0.4556765163297045
              ]
            }
          ],
          "markingRegions": [],
          "text": "QUESTION 5 Use a SEPARATE Writing Booklet."
        }
      ]
    },
    {
      "number": "6",
      "marks": null,
      "topic": null,
      "module": null,
      "syllabusRefs": [],
      "type": null,
      "marksPrinted": false,
      "stimulus": [],
      "text": "QUESTION 6 Use a SEPARATE Writing Booklet.",
      "parts": [
        {
          "label": null,
          "marks": null,
          "type": null,
          "marksPrinted": false,
          "regions": [
            {
              "page": 3,
              "bbox": [
                0.06,
                0.4476765163297045,
                0.95,
                1.0
              ]
            }
          ],
          "markingRegions": [],
          "text": "QUESTION 6 Use a SEPARATE Writing Booklet."
        }
      ]
    },
    {
      "number": "7",
      "marks": null,
      "topic": null,
      "module": null,
      "syllabusRefs": [],
      "type": null,
      "marksPrinted": true,
      "stimulus": [],
      "text": "QUESTION 7 Use a SEPARATE Writing Booklet, Marks",
      "parts": [
        {
          "label": null,
          "marks": 2,
          "type": null,
          "marksPrinted": true,
          "regions": [
            {
              "page": 4,
              "bbox": [
                0.06,
                0.044877138413685846,
                0.95,
                0.5482115085536547
              ]
            }
          ],
          "markingRegions": [],
          "text": "QUESTION 7 Use a SEPARATE Writing Booklet, Marks"
        }
      ]
    },
    {
      "number": "8",
      "marks": null,
      "topic": null,
      "module": null,
      "syllabusRefs": [],
      "type": null,
      "marksPrinted": false,
      "stimulus": [],
      "text": "QUESTION 8 Use a SEPARATE Writing Booklet.",
      "parts": [
        {
          "label": null,
          "marks": null,
          "type": null,
          "marksPrinted": false,
          "regions": [
            {
              "page": 4,
              "bbox": [
                0.06,
                0.5402115085536547,
                0.95,
                1.0
              ]
            }
          ],
          "markingRegions": [],
          "text": "QUESTION 8 Use a SEPARATE Writing Booklet."
        }
      ]
    },
    {
      "number": "9",
      "marks": null,
      "topic": null,
      "module": null,
      "syllabusRefs": [],
      "type": null,
      "marksPrinted": true,
      "stimulus": [],
      "text": "QUESTION 9 Use a SEPARATE Writing Booklet. Marks",
      "parts": [
        {
          "label": null,
          "marks": 3,
          "type": null,
          "marksPrinted": true,
          "regions": [
            {
              "page": 5,
              "bbox": [
                0.06,
                0.14596578538102642,
                0.95,
                1.0
              ]
            }
          ],
          "markingRegions": [],
          "text": "QUESTION 9 Use a SEPARATE Writing Booklet. Marks"
        }
      ]
    },
    {
      "number": "10",
      "marks": null,
      "topic": null,
      "module": null,
      "syllabusRefs": [],
      "type": null,
      "marksPrinted": false,
      "stimulus": [],
      "text": "QUESTION 10 Use a SEPARATE Writing Booklet.",
      "parts": [
        {
          "label": null,
          "marks": null,
          "type": null,
          "marksPrinted": false,
          "regions": [
            {
              "page": 6,
              "bbox": [
                0.06,
                0.052653188180404355,
                0.95,
                1.0
              ]
            }
          ],
          "markingRegions": [],
          "text": "QUESTION 10 Use a SEPARATE Writing Booklet."
        }
      ]
    }
  ]
}