{
  "paperId": "maths-extension-2-y12-hsc-1982-hsc",
  "subject": "maths-extension-2",
  "source": "ocr",
  "questions": [
    {
      "number": "1",
      "marks": 1,
      "topic": "Curve Analysis, Turning Points & Common Points Proof",
      "module": "Calculus",
      "syllabusRefs": [
        "ME-C1",
        "ME-P1"
      ],
      "type": "mc",
      "stimulus": [],
      "text": "1. (i) Prove that the curve: y = has a minimum at A(—1,—2), a maximum",
      "parts": [
        {
          "label": null,
          "marks": 1,
          "type": "mc",
          "regions": [
            {
              "page": 0,
              "bbox": [
                0.06,
                0.14196114996114995,
                0.95,
                0.2867132867132867
              ]
            }
          ],
          "markingRegions": [],
          "text": "1. (i) Prove that the curve: y = has a minimum at A(—1,—2), a maximum"
        }
      ]
    },
    {
      "number": "2",
      "marks": 1,
      "topic": "Integration Techniques & Reduction Formulae",
      "module": "Calculus",
      "syllabusRefs": [
        "ME-C1"
      ],
      "type": "mc",
      "stimulus": [],
      "text": "2. (i) Find the indefinite integrals: (a) + «2)® dx;",
      "parts": [
        {
          "label": null,
          "marks": 1,
          "type": "mc",
          "regions": [
            {
              "page": 0,
              "bbox": [
                0.06,
                0.2787132867132867,
                0.95,
                0.31313131313131315
              ]
            }
          ],
          "markingRegions": [],
          "text": "2. (i) Find the indefinite integrals: (a) + «2)® dx;"
        },
        {
          "label": "b",
          "marks": null,
          "type": null,
          "regions": [
            {
              "page": 0,
              "bbox": [
                0.06,
                0.30513131313131314,
                0.95,
                0.43045843045843046
              ]
            }
          ],
          "markingRegions": [],
          "text": "(b) f(x — 4g)? ar, for « > 2."
        }
      ]
    },
    {
      "number": "3",
      "marks": 1,
      "topic": "Complex Numbers - Modulus, Argument, Roots & Loci",
      "module": "Complex Numbers",
      "syllabusRefs": [
        "ME-N1",
        "ME-N2"
      ],
      "type": "mc",
      "stimulus": [],
      "text": "3. (i) For the complex number z = 1 — Vi, find |z|, arg 2. Also express each of",
      "parts": [
        {
          "label": null,
          "marks": 1,
          "type": "mc",
          "regions": [
            {
              "page": 0,
              "bbox": [
                0.06,
                0.42245843045843046,
                0.95,
                0.6184926184926185
              ]
            }
          ],
          "markingRegions": [],
          "text": "3. (i) For the complex number z = 1 — Vi, find |z|, arg 2. Also express each of"
        }
      ]
    },
    {
      "number": "4",
      "marks": 1,
      "topic": "Conics - Rectangular Hyperbola",
      "module": "Calculus",
      "syllabusRefs": [
        "ME-C1"
      ],
      "type": "mc",
      "stimulus": [],
      "text": "4. With respect to axes Ox, Oy, the line x = 1 is a directrix, and the point (2,0) a",
      "parts": [
        {
          "label": null,
          "marks": 1,
          "type": "mc",
          "regions": [
            {
              "page": 0,
              "bbox": [
                0.06,
                0.6104926184926185,
                0.95,
                0.6612276612276612
              ]
            }
          ],
          "markingRegions": [],
          "text": "4. With respect to axes Ox, Oy, the line x = 1 is a directrix, and the point (2,0) a"
        },
        {
          "label": "a",
          "marks": null,
          "type": null,
          "regions": [
            {
              "page": 0,
              "bbox": [
                0.06,
                0.6532276612276612,
                0.95,
                0.7047397047397047
              ]
            }
          ],
          "markingRegions": [],
          "text": "(a) Find the equation of the conic, show that it is a rectangular hyperbola, and"
        },
        {
          "label": "b",
          "marks": null,
          "type": null,
          "regions": [
            {
              "page": 0,
              "bbox": [
                0.06,
                0.6967397047397047,
                0.95,
                0.7296037296037297
              ]
            }
          ],
          "markingRegions": [],
          "text": "(b) Find the equation of the normal to the curve at any point P on it"
        },
        {
          "label": "c",
          "marks": null,
          "type": null,
          "regions": [
            {
              "page": 0,
              "bbox": [
                0.06,
                0.7216037296037296,
                0.95,
                0.7972027972027972
              ]
            }
          ],
          "markingRegions": [],
          "text": "(c) The normal to the curve at P meets Ox,Oy in (X,0),(0,Y),"
        }
      ]
    },
    {
      "number": "5",
      "marks": 1,
      "topic": "Volumes of Revolution (Cylindrical Shells) & Curve Proof",
      "module": "Calculus",
      "syllabusRefs": [
        "ME-C1"
      ],
      "type": "mc",
      "stimulus": [],
      "text": "5. (i) Write down the volume of a right",
      "parts": [
        {
          "label": null,
          "marks": 1,
          "type": "mc",
          "regions": [
            {
              "page": 0,
              "bbox": [
                0.06,
                0.7892027972027972,
                0.95,
                1.0
              ]
            }
          ],
          "markingRegions": [],
          "text": "5. (i) Write down the volume of a right"
        }
      ]
    },
    {
      "number": "6",
      "marks": 1,
      "topic": "Conical Pendulum / Circular Motion",
      "module": "Mechanics",
      "syllabusRefs": [
        "ME-M1"
      ],
      "type": "mc",
      "stimulus": [],
      "text": "6. A “chair-o-plane” at a fairground cons",
      "parts": [
        {
          "label": null,
          "marks": 1,
          "type": "mc",
          "regions": [
            {
              "page": 1,
              "bbox": [
                0.06,
                0.19479720279720278,
                0.95,
                0.5446775446775447
              ]
            }
          ],
          "markingRegions": [],
          "text": "6. A “chair-o-plane” at a fairground cons"
        },
        {
          "label": "a",
          "marks": null,
          "type": null,
          "regions": [
            {
              "page": 1,
              "bbox": [
                0.06,
                0.5366775446775447,
                0.95,
                0.5710955710955711
              ]
            }
          ],
          "markingRegions": [],
          "text": "(a) Show that w,4 satisfy the relation (R + ="
        },
        {
          "label": "b",
          "marks": null,
          "type": null,
          "regions": [
            {
              "page": 1,
              "bbox": [
                0.06,
                0.5630955710955711,
                0.95,
                0.6146076146076146
              ]
            }
          ],
          "markingRegions": [],
          "text": "(b) Use a graphical means to show that, for given w there is just one value of 8 in"
        },
        {
          "label": "c",
          "marks": null,
          "type": null,
          "regions": [
            {
              "page": 1,
              "bbox": [
                0.06,
                0.6066076146076146,
                0.95,
                0.6666666666666666
              ]
            }
          ],
          "markingRegions": [],
          "text": "(c) Given R = 6,h = 2,6 = 60°, and assuming that g = find the speed of"
        }
      ]
    },
    {
      "number": "7",
      "marks": 1,
      "topic": "De Moivre's Theorem & Trigonometric Identities",
      "module": "Complex Numbers",
      "syllabusRefs": [
        "ME-N2"
      ],
      "type": "mc",
      "stimulus": [],
      "text": "7. (i) Find all x such that: cosx-+sina = 1+ sin2z, and 0 <2 < 2m.",
      "parts": [
        {
          "label": null,
          "marks": 1,
          "type": "mc",
          "regions": [
            {
              "page": 1,
              "bbox": [
                0.06,
                0.6586666666666666,
                0.95,
                0.7707847707847708
              ]
            }
          ],
          "markingRegions": [],
          "text": "7. (i) Find all x such that: cosx-+sina = 1+ sin2z, and 0 <2 < 2m."
        }
      ]
    },
    {
      "number": "8",
      "marks": 1,
      "topic": "Mathematical Induction - Inequality & Recurrence",
      "module": "Proof",
      "syllabusRefs": [
        "ME-P2"
      ],
      "type": "mc",
      "stimulus": [],
      "text": "8. (i) Given that a, = \\/2+4a,_1 for integers n > 1, and that ag = 1, prove that,",
      "parts": [
        {
          "label": null,
          "marks": 1,
          "type": "mc",
          "regions": [
            {
              "page": 1,
              "bbox": [
                0.06,
                0.7627847707847708,
                0.95,
                1.0
              ]
            }
          ],
          "markingRegions": [],
          "text": "8. (i) Given that a, = \\/2+4a,_1 for integers n > 1, and that ag = 1, prove that,"
        }
      ]
    }
  ]
}