{
  "paperId": "maths-advanced-ace-halfyearly-2018-p-2u-baulkham-hills-prelim-half-yearly-exam-paper",
  "subject": "maths-advanced",
  "source": "ocr",
  "questions": [
    {
      "number": "1",
      "marks": 1,
      "topic": null,
      "module": null,
      "syllabusRefs": [],
      "type": "mc",
      "marksPrinted": true,
      "stimulus": [],
      "text": "1 Which one of the following expressions represents the factored form of 8x\u00b0 +",
      "parts": [
        {
          "label": null,
          "marks": 1,
          "type": "mc",
          "marksPrinted": true,
          "regions": [
            {
              "page": 1,
              "bbox": [
                0.06,
                0.1878041958041958,
                0.95,
                0.43745143745143744
              ]
            }
          ],
          "markingRegions": [],
          "text": "1 Which one of the following expressions represents the factored form of 8x\u00b0 +"
        }
      ]
    },
    {
      "number": "2",
      "marks": 1,
      "topic": null,
      "module": null,
      "syllabusRefs": [],
      "type": "mc",
      "marksPrinted": true,
      "stimulus": [],
      "text": "2 Which of the following is a function?",
      "parts": [
        {
          "label": null,
          "marks": 1,
          "type": "mc",
          "marksPrinted": true,
          "regions": [
            {
              "page": 1,
              "bbox": [
                0.06,
                0.42945143745143743,
                0.95,
                1.0
              ]
            }
          ],
          "markingRegions": [],
          "text": "2 Which of the following is a function?"
        },
        {
          "label": "a",
          "marks": null,
          "type": null,
          "marksPrinted": false,
          "regions": [
            {
              "page": 3,
              "bbox": [
                0.06,
                0.5265765345765345,
                0.95,
                1.0
              ]
            }
          ],
          "markingRegions": [],
          "text": "(a)"
        }
      ]
    },
    {
      "number": "11",
      "marks": 12,
      "topic": null,
      "module": null,
      "syllabusRefs": [],
      "type": null,
      "marksPrinted": true,
      "stimulus": [
        {
          "page": 5,
          "bbox": [
            0.06,
            0.25462626262626264,
            0.95,
            0.39937839937839936
          ]
        }
      ],
      "text": "Question 11 (12 marks) Use a separate answer sheet",
      "parts": [
        {
          "label": "b",
          "marks": null,
          "type": null,
          "marksPrinted": false,
          "regions": [
            {
              "page": 5,
              "bbox": [
                0.06,
                0.39137839937839936,
                0.95,
                0.5625485625485626
              ]
            }
          ],
          "markingRegions": [],
          "text": "(b)"
        },
        {
          "label": "d",
          "marks": null,
          "type": null,
          "marksPrinted": false,
          "regions": [
            {
              "page": 5,
              "bbox": [
                0.06,
                0.5545485625485626,
                0.95,
                1.0
              ]
            }
          ],
          "markingRegions": [],
          "text": "(d)"
        }
      ]
    },
    {
      "number": "16",
      "marks": null,
      "topic": null,
      "module": null,
      "syllabusRefs": [],
      "type": null,
      "marksPrinted": true,
      "stimulus": [
        {
          "page": 11,
          "bbox": [
            0.06,
            0.09689510489510489,
            0.95,
            0.14607614607614608
          ]
        }
      ],
      "text": "Question 16 (continued)",
      "parts": [
        {
          "label": "c",
          "marks": 1,
          "type": null,
          "marksPrinted": true,
          "regions": [
            {
              "page": 11,
              "bbox": [
                0.06,
                0.13807614607614607,
                0.95,
                0.7094017094017094
              ]
            }
          ],
          "markingRegions": [],
          "text": "(c) B are two points 1500 metres apart on a road running due west. A soldier"
        }
      ]
    }
  ]
}