{
  "paperId": "maths-advanced-y12-trial-caringbah-2018-w-sol",
  "subject": "maths-advanced",
  "source": "ocr",
  "questions": [
    {
      "number": "1",
      "marks": 1,
      "topic": null,
      "module": null,
      "syllabusRefs": [],
      "type": "mc",
      "marksPrinted": true,
      "stimulus": [],
      "text": "1. The graph below shows the function:",
      "parts": [
        {
          "label": null,
          "marks": 1,
          "type": "mc",
          "marksPrinted": true,
          "regions": [
            {
              "page": 2,
              "bbox": [
                0.06,
                0.20334421134421135,
                0.95,
                0.6946386946386947
              ]
            }
          ],
          "markingRegions": [],
          "text": "1. The graph below shows the function:"
        }
      ]
    },
    {
      "number": "2",
      "marks": 1,
      "topic": null,
      "module": null,
      "syllabusRefs": [],
      "type": "mc",
      "marksPrinted": true,
      "stimulus": [],
      "text": "2 3x41",
      "parts": [
        {
          "label": null,
          "marks": 1,
          "type": "mc",
          "marksPrinted": true,
          "regions": [
            {
              "page": 2,
              "bbox": [
                0.06,
                0.6866386946386946,
                0.95,
                1.0
              ]
            }
          ],
          "markingRegions": [],
          "text": "2 3x41"
        }
      ]
    },
    {
      "number": "12",
      "marks": 15,
      "topic": null,
      "module": null,
      "syllabusRefs": [],
      "type": null,
      "marksPrinted": true,
      "stimulus": [],
      "text": "Question 12 (15 marks) Use a SEPARATE writing booklet.",
      "parts": [
        {
          "label": null,
          "marks": 15,
          "type": null,
          "marksPrinted": true,
          "regions": [
            {
              "page": 7,
              "bbox": [
                0.06,
                0.04095104895104895,
                0.95,
                0.8671328671328671
              ]
            }
          ],
          "markingRegions": [],
          "text": "Question 12 (15 marks) Use a SEPARATE writing booklet."
        }
      ]
    },
    {
      "number": "13",
      "marks": 15,
      "topic": null,
      "module": null,
      "syllabusRefs": [],
      "type": null,
      "marksPrinted": true,
      "stimulus": [
        {
          "page": 8,
          "bbox": [
            0.06,
            0.037066045066045064,
            0.95,
            0.09867909867909867
          ]
        }
      ],
      "text": "Question 13 (15 marks) Use a SEPARATE writing booklet.",
      "parts": [
        {
          "label": "a",
          "marks": null,
          "type": null,
          "marksPrinted": false,
          "regions": [
            {
              "page": 8,
              "bbox": [
                0.06,
                0.09067909867909868,
                0.95,
                0.41414141414141414
              ]
            }
          ],
          "markingRegions": [],
          "text": "(a) The shaded region that lies between the x-axis and the line y=10~3x from"
        },
        {
          "label": "b",
          "marks": 2,
          "type": null,
          "marksPrinted": true,
          "regions": [
            {
              "page": 8,
              "bbox": [
                0.06,
                0.40614141414141414,
                0.95,
                0.8383838383838383
              ]
            }
          ],
          "markingRegions": [],
          "text": "(b) The graph of a function has the following properties:"
        },
        {
          "label": "e",
          "marks": 2,
          "type": null,
          "marksPrinted": true,
          "regions": [
            {
              "page": 8,
              "bbox": [
                0.06,
                0.8303838383838383,
                0.95,
                0.8896658896658897
              ]
            }
          ],
          "markingRegions": [],
          "text": "(e)  Factorise fully +24a-9"
        }
      ]
    },
    {
      "number": "14",
      "marks": 15,
      "topic": null,
      "module": null,
      "syllabusRefs": [],
      "type": null,
      "marksPrinted": true,
      "stimulus": [
        {
          "page": 9,
          "bbox": [
            0.06,
            0.06348407148407148,
            0.95,
            0.5889665889665889
          ]
        }
      ],
      "text": "Question 14 (15 marks) Use a SEPARATE writing booklet.",
      "parts": [
        {
          "label": "b",
          "marks": null,
          "type": null,
          "marksPrinted": false,
          "regions": [
            {
              "page": 9,
              "bbox": [
                0.06,
                0.5809665889665889,
                0.95,
                0.83993783993784
              ]
            }
          ],
          "markingRegions": [],
          "text": "(b)"
        }
      ]
    },
    {
      "number": "15",
      "marks": 15,
      "topic": null,
      "module": null,
      "syllabusRefs": [],
      "type": null,
      "marksPrinted": true,
      "stimulus": [
        {
          "page": 11,
          "bbox": [
            0.06,
            0.04172804972804973,
            0.95,
            0.1048951048951049
          ]
        }
      ],
      "text": "Question 15 (15 marks) Use a SEPARATE writing booklet.",
      "parts": [
        {
          "label": "a",
          "marks": 3,
          "type": null,
          "marksPrinted": true,
          "regions": [
            {
              "page": 11,
              "bbox": [
                0.06,
                0.09689510489510489,
                0.95,
                0.46386946386946387
              ]
            }
          ],
          "markingRegions": [],
          "text": "(a)"
        },
        {
          "label": "b",
          "marks": 1,
          "type": null,
          "marksPrinted": true,
          "regions": [
            {
              "page": 11,
              "bbox": [
                0.06,
                0.45586946386946386,
                0.95,
                0.8935508935508936
              ]
            }
          ],
          "markingRegions": [],
          "text": "(b)"
        }
      ]
    },
    {
      "number": "16",
      "marks": 15,
      "topic": null,
      "module": null,
      "syllabusRefs": [],
      "type": null,
      "marksPrinted": true,
      "stimulus": [
        {
          "page": 12,
          "bbox": [
            0.06,
            0.037066045066045064,
            0.95,
            0.09401709401709402
          ]
        }
      ],
      "text": "Question 16 (15 marks) Use a SEPARATE writing booklet.",
      "parts": [
        {
          "label": "a",
          "marks": 4,
          "type": null,
          "marksPrinted": true,
          "regions": [
            {
              "page": 12,
              "bbox": [
                0.06,
                0.08601709401709401,
                0.95,
                0.3278943278943279
              ]
            }
          ],
          "markingRegions": [],
          "text": "(a) Water is draining from a storage tank at a rate that is proportional to the volume"
        },
        {
          "label": "b",
          "marks": 2,
          "type": null,
          "marksPrinted": true,
          "regions": [
            {
              "page": 12,
              "bbox": [
                0.06,
                0.31989432789432787,
                0.95,
                0.8857808857808858
              ]
            }
          ],
          "markingRegions": [],
          "text": "(b) A right-angled triangle ACB is placed in a sector of a circle with radius 8 cm."
        },
        {
          "label": "c",
          "marks": null,
          "type": null,
          "marksPrinted": false,
          "regions": [
            {
              "page": 15,
              "bbox": [
                0.06,
                0.4227692307692308,
                0.95,
                1.0
              ]
            }
          ],
          "markingRegions": [],
          "text": "(c)"
        }
      ]
    }
  ]
}