{
  "paperId": "maths-advanced-y12-trial-sydney-tech-2014-w-sol",
  "subject": "maths-advanced",
  "source": "ocr",
  "questions": [
    {
      "number": "1",
      "marks": 1,
      "topic": null,
      "module": null,
      "syllabusRefs": [],
      "type": "mc",
      "marksPrinted": true,
      "stimulus": [],
      "text": "1. Find the values of m for which 24+ 2m\u2014m\u2019 <0",
      "parts": [
        {
          "label": null,
          "marks": 1,
          "type": "mc",
          "marksPrinted": true,
          "regions": [
            {
              "page": 1,
              "bbox": [
                0.06,
                0.25307226107226105,
                0.95,
                0.34265734265734266
              ]
            }
          ],
          "markingRegions": [],
          "text": "1. Find the values of m for which 24+ 2m\u2014m\u2019 <0"
        }
      ]
    },
    {
      "number": "2",
      "marks": 1,
      "topic": null,
      "module": null,
      "syllabusRefs": [],
      "type": "mc",
      "marksPrinted": true,
      "stimulus": [],
      "text": "2. The sector below has an area of 10m square units.",
      "parts": [
        {
          "label": null,
          "marks": 1,
          "type": "mc",
          "marksPrinted": true,
          "regions": [
            {
              "page": 1,
              "bbox": [
                0.06,
                0.33465734265734265,
                0.95,
                0.5314685314685315
              ]
            }
          ],
          "markingRegions": [],
          "text": "2. The sector below has an area of 10m square units."
        },
        {
          "label": "a",
          "marks": null,
          "type": null,
          "marksPrinted": false,
          "regions": [
            {
              "page": 1,
              "bbox": [
                0.06,
                0.5234685314685315,
                0.95,
                0.5843045843045843
              ]
            }
          ],
          "markingRegions": [],
          "text": "(a) -v60 (c)"
        }
      ]
    },
    {
      "number": "3",
      "marks": 1,
      "topic": null,
      "module": null,
      "syllabusRefs": [],
      "type": "mc",
      "marksPrinted": true,
      "stimulus": [],
      "text": "3. + V63 ..",
      "parts": [
        {
          "label": null,
          "marks": 1,
          "type": "mc",
          "marksPrinted": true,
          "regions": [
            {
              "page": 1,
              "bbox": [
                0.06,
                0.5763045843045843,
                0.95,
                0.696969696969697
              ]
            }
          ],
          "markingRegions": [],
          "text": "3. + V63 .."
        }
      ]
    },
    {
      "number": "4",
      "marks": 1,
      "topic": null,
      "module": null,
      "syllabusRefs": [],
      "type": "mc",
      "marksPrinted": true,
      "stimulus": [],
      "text": "4. For what values of x is the curve f(x) = 2 x? + x concave down?",
      "parts": [
        {
          "label": null,
          "marks": 1,
          "type": "mc",
          "marksPrinted": true,
          "regions": [
            {
              "page": 1,
              "bbox": [
                0.06,
                0.688969696969697,
                0.95,
                0.8329448329448329
              ]
            }
          ],
          "markingRegions": [],
          "text": "4. For what values of x is the curve f(x) = 2 x? + x concave down?"
        }
      ]
    },
    {
      "number": "5",
      "marks": 1,
      "topic": null,
      "module": null,
      "syllabusRefs": [],
      "type": "mc",
      "marksPrinted": true,
      "stimulus": [],
      "text": "5. Given that the curve y = ax*\u20148 has a stationary point at x = 2, find",
      "parts": [
        {
          "label": null,
          "marks": 1,
          "type": "mc",
          "marksPrinted": true,
          "regions": [
            {
              "page": 1,
              "bbox": [
                0.06,
                0.8249448329448329,
                0.95,
                0.8787878787878788
              ]
            }
          ],
          "markingRegions": [],
          "text": "5. Given that the curve y = ax*\u20148 has a stationary point at x = 2, find"
        },
        {
          "label": "a",
          "marks": null,
          "type": null,
          "marksPrinted": false,
          "regions": [
            {
              "page": 1,
              "bbox": [
                0.06,
                0.8707878787878788,
                0.95,
                1.0
              ]
            }
          ],
          "markingRegions": [],
          "text": "(a) a= (B) a=2 a=6 (D) a=-2"
        },
        {
          "label": "c",
          "marks": null,
          "type": null,
          "marksPrinted": false,
          "regions": [
            {
              "page": 2,
              "bbox": [
                0.06,
                0.8358228438228438,
                0.95,
                1.0
              ]
            }
          ],
          "markingRegions": [],
          "text": "(c) A =| +8) \u2014 x? dx [4x4 8) -"
        }
      ]
    },
    {
      "number": "11",
      "marks": null,
      "topic": null,
      "module": null,
      "syllabusRefs": [],
      "type": null,
      "marksPrinted": true,
      "stimulus": [],
      "text": "Question 11",
      "parts": [
        {
          "label": null,
          "marks": 2,
          "type": null,
          "marksPrinted": true,
          "regions": [
            {
              "page": 4,
              "bbox": [
                0.06,
                0.26783527583527583,
                0.95,
                1.0
              ]
            }
          ],
          "markingRegions": [],
          "text": "Question 11"
        }
      ]
    },
    {
      "number": "12",
      "marks": null,
      "topic": null,
      "module": null,
      "syllabusRefs": [],
      "type": null,
      "marksPrinted": true,
      "stimulus": [],
      "text": "Question 12 Start a new page",
      "parts": [
        {
          "label": null,
          "marks": 1,
          "type": null,
          "marksPrinted": true,
          "regions": [
            {
              "page": 5,
              "bbox": [
                0.06,
                0.05882206682206682,
                0.95,
                1.0
              ]
            }
          ],
          "markingRegions": [],
          "text": "Question 12 Start a new page"
        }
      ]
    },
    {
      "number": "13",
      "marks": null,
      "topic": null,
      "module": null,
      "syllabusRefs": [],
      "type": null,
      "marksPrinted": true,
      "stimulus": [],
      "text": "Question 13 Start a new page",
      "parts": [
        {
          "label": null,
          "marks": 2,
          "type": null,
          "marksPrinted": true,
          "regions": [
            {
              "page": 6,
              "bbox": [
                0.06,
                0.045613053613053615,
                0.95,
                1.0
              ]
            }
          ],
          "markingRegions": [],
          "text": "Question 13 Start a new page"
        }
      ]
    },
    {
      "number": "14",
      "marks": null,
      "topic": null,
      "module": null,
      "syllabusRefs": [],
      "type": null,
      "marksPrinted": false,
      "stimulus": [],
      "text": "Question 14 Start a new page",
      "parts": [
        {
          "label": null,
          "marks": null,
          "type": null,
          "marksPrinted": false,
          "regions": [
            {
              "page": 8,
              "bbox": [
                0.06,
                0.056491064491064495,
                0.95,
                1.0
              ]
            }
          ],
          "markingRegions": [],
          "text": "Question 14 Start a new page"
        }
      ]
    },
    {
      "number": "15",
      "marks": null,
      "topic": null,
      "module": null,
      "syllabusRefs": [],
      "type": null,
      "marksPrinted": true,
      "stimulus": [],
      "text": "Question 15 Start a new page",
      "parts": [
        {
          "label": null,
          "marks": 1,
          "type": null,
          "marksPrinted": true,
          "regions": [
            {
              "page": 9,
              "bbox": [
                0.06,
                0.03395804195804196,
                0.95,
                1.0
              ]
            }
          ],
          "markingRegions": [],
          "text": "Question 15 Start a new page"
        }
      ]
    },
    {
      "number": "16",
      "marks": null,
      "topic": null,
      "module": null,
      "syllabusRefs": [],
      "type": null,
      "marksPrinted": false,
      "stimulus": [],
      "text": "Question 16 Start a new page",
      "parts": [
        {
          "label": null,
          "marks": null,
          "type": null,
          "marksPrinted": false,
          "regions": [
            {
              "page": 10,
              "bbox": [
                0.06,
                0.03240404040404041,
                0.95,
                1.0
              ]
            }
          ],
          "markingRegions": [],
          "text": "Question 16 Start a new page"
        }
      ]
    }
  ]
}