{
  "paperId": "maths-advanced-y12-trial-sydney-grammar-2017-w-sol",
  "subject": "maths-advanced",
  "source": "ocr",
  "questions": [
    {
      "number": null,
      "marks": null,
      "topic": null,
      "module": null,
      "syllabusRefs": [],
      "type": null,
      "marksPrinted": true,
      "stimulus": [],
      "text": "",
      "parts": [
        {
          "label": "a",
          "marks": null,
          "type": null,
          "marksPrinted": false,
          "regions": [
            {
              "page": 3,
              "bbox": [
                0.06,
                0.15296423017107308,
                0.95,
                1.0
              ]
            }
          ],
          "markingRegions": [],
          "text": "(a)"
        },
        {
          "label": "a",
          "marks": 1,
          "type": null,
          "marksPrinted": true,
          "regions": [
            {
              "page": 6,
              "bbox": [
                0.06,
                0.13274650077760497,
                0.95,
                0.30326594090202175
              ]
            }
          ],
          "markingRegions": [],
          "text": "(a) Find:"
        },
        {
          "label": "b",
          "marks": 1,
          "type": null,
          "marksPrinted": true,
          "regions": [
            {
              "page": 6,
              "bbox": [
                0.06,
                0.29526594090202174,
                0.95,
                0.4354587869362364
              ]
            }
          ],
          "markingRegions": [],
          "text": "(b) The equation 22?"
        },
        {
          "label": "c",
          "marks": 2,
          "type": null,
          "marksPrinted": true,
          "regions": [
            {
              "page": 6,
              "bbox": [
                0.06,
                0.4274587869362364,
                0.95,
                0.8017107309486781
              ]
            }
          ],
          "markingRegions": [],
          "text": "(c) Differentiate the following, giving your answers in fully factorised form:"
        },
        {
          "label": "c",
          "marks": 2,
          "type": null,
          "marksPrinted": true,
          "regions": [
            {
              "page": 6,
              "bbox": [
                0.06,
                0.7937107309486781,
                0.95,
                1.0
              ]
            }
          ],
          "markingRegions": [],
          "text": "(c) Evaluate [ cos 2a dx."
        },
        {
          "label": "a",
          "marks": null,
          "type": null,
          "marksPrinted": false,
          "regions": [
            {
              "page": 7,
              "bbox": [
                0.06,
                0.13274650077760497,
                0.95,
                0.19206842923794712
              ]
            }
          ],
          "markingRegions": [],
          "text": "(a) Find the equation of the tangent to the curve y = sin ma at the point where"
        },
        {
          "label": "b",
          "marks": null,
          "type": null,
          "marksPrinted": false,
          "regions": [
            {
              "page": 7,
              "bbox": [
                0.06,
                0.1840684292379471,
                0.95,
                0.640746500777605
              ]
            }
          ],
          "markingRegions": [],
          "text": "(b) (6,3)"
        },
        {
          "label": "c",
          "marks": null,
          "type": null,
          "marksPrinted": false,
          "regions": [
            {
              "page": 7,
              "bbox": [
                0.06,
                0.632746500777605,
                0.95,
                1.0
              ]
            }
          ],
          "markingRegions": [],
          "text": "(c) Solve the equation x\u00b0 + 7x3 \u2014 8 = 0."
        },
        {
          "label": "a",
          "marks": null,
          "type": null,
          "marksPrinted": false,
          "regions": [
            {
              "page": 8,
              "bbox": [
                0.06,
                0.09853188180404354,
                0.95,
                1.0
              ]
            }
          ],
          "markingRegions": [],
          "text": "(a)"
        },
        {
          "label": "a",
          "marks": 1,
          "type": null,
          "marksPrinted": true,
          "regions": [
            {
              "page": 9,
              "bbox": [
                0.06,
                0.13274650077760497,
                0.95,
                0.4051321928460342
              ]
            }
          ],
          "markingRegions": [],
          "text": "(a) Nigel is in his third year of working for Reliable Real Estate. During this"
        },
        {
          "label": "b",
          "marks": 1,
          "type": null,
          "marksPrinted": true,
          "regions": [
            {
              "page": 9,
              "bbox": [
                0.06,
                0.3971321928460342,
                0.95,
                0.8118195956454122
              ]
            }
          ],
          "markingRegions": [],
          "text": "(b)"
        },
        {
          "label": "c",
          "marks": 1,
          "type": null,
          "marksPrinted": true,
          "regions": [
            {
              "page": 9,
              "bbox": [
                0.06,
                0.8038195956454122,
                0.95,
                1.0
              ]
            }
          ],
          "markingRegions": [],
          "text": "(c) Consider the quadratic equation x\u201d \u2014 ka + (3 \u2014 k) = 0."
        },
        {
          "label": "a",
          "marks": 1,
          "type": null,
          "marksPrinted": true,
          "regions": [
            {
              "page": 10,
              "bbox": [
                0.06,
                0.1241928460342146,
                0.95,
                0.328149300155521
              ]
            }
          ],
          "markingRegions": [],
          "text": "(a) The velocity of a particle moving along the z-axis is given by \u00a2 = 10\u00a2\u2014 40"
        },
        {
          "label": "b",
          "marks": 1,
          "type": null,
          "marksPrinted": true,
          "regions": [
            {
              "page": 10,
              "bbox": [
                0.06,
                0.320149300155521,
                0.95,
                1.0
              ]
            }
          ],
          "markingRegions": [],
          "text": "(b) The age of a wooden bowl is to be found using carbon dating. The"
        },
        {
          "label": "a",
          "marks": null,
          "type": null,
          "marksPrinted": false,
          "regions": [
            {
              "page": 12,
              "bbox": [
                0.06,
                0.13274650077760497,
                0.95,
                0.5272161741835147
              ]
            }
          ],
          "markingRegions": [],
          "text": "(a)"
        },
        {
          "label": "b",
          "marks": null,
          "type": null,
          "marksPrinted": false,
          "regions": [
            {
              "page": 12,
              "bbox": [
                0.06,
                0.5192161741835147,
                0.95,
                1.0
              ]
            }
          ],
          "markingRegions": [],
          "text": "(b) Geoff has found an idyllic beach house and needs to borrow $800 000 from"
        },
        {
          "label": "c",
          "marks": null,
          "type": null,
          "marksPrinted": false,
          "regions": [
            {
              "page": 13,
              "bbox": [
                0.06,
                0.09853188180404354,
                0.95,
                0.6524105754276828
              ]
            }
          ],
          "markingRegions": [],
          "text": "(c) At a music concert two speaker towers are placed 75 metres apart. The"
        }
      ]
    }
  ]
}