{
  "paperId": "english-eal-d-hsc-nesa-2022-hsc-english-eald-listening",
  "subject": "english-eal-d",
  "source": "ocr",
  "questions": [
    {
      "number": "2",
      "marks": 3,
      "topic": null,
      "module": null,
      "syllabusRefs": [],
      "type": null,
      "stimulus": [],
      "text": "Question 2 (3 marks)",
      "parts": [
        {
          "label": null,
          "marks": 3,
          "type": null,
          "regions": [
            {
              "page": 2,
              "bbox": [
                0.06,
                0.07358508158508159,
                0.95,
                0.33644133644133645
              ]
            }
          ],
          "markingRegions": [],
          "text": "Question 2 (3 marks)"
        }
      ]
    },
    {
      "number": "3",
      "marks": 4,
      "topic": null,
      "module": null,
      "syllabusRefs": [],
      "type": null,
      "stimulus": [],
      "text": "Question 3 (4 marks)",
      "parts": [
        {
          "label": null,
          "marks": 4,
          "type": null,
          "regions": [
            {
              "page": 2,
              "bbox": [
                0.06,
                0.32844133644133644,
                0.95,
                1.0
              ]
            }
          ],
          "markingRegions": [],
          "text": "Question 3 (4 marks)"
        }
      ]
    },
    {
      "number": "4",
      "marks": 5,
      "topic": null,
      "module": null,
      "syllabusRefs": [],
      "type": null,
      "stimulus": [],
      "text": "Question 4 (5 marks)",
      "parts": [
        {
          "label": null,
          "marks": 5,
          "type": null,
          "regions": [
            {
              "page": 3,
              "bbox": [
                0.06,
                0.07358508158508159,
                0.95,
                1.0
              ]
            }
          ],
          "markingRegions": [],
          "text": "Question 4 (5 marks)"
        }
      ]
    }
  ]
}