{
  "paperId": "maths-advanced-ace-trial-2017-2u-gosford-trials-with-solutions",
  "subject": "maths-advanced",
  "source": "ocr",
  "questions": [
    {
      "number": "11",
      "marks": 15,
      "topic": null,
      "module": null,
      "syllabusRefs": [],
      "type": null,
      "marksPrinted": true,
      "stimulus": [],
      "text": "Question 11 (15 marks) Use a separate writing booklet.",
      "parts": [
        {
          "label": null,
          "marks": 15,
          "type": null,
          "marksPrinted": true,
          "regions": [
            {
              "page": 2,
              "bbox": [
                0.06,
                0.2876043956043956,
                0.95,
                1.0
              ]
            }
          ],
          "markingRegions": [],
          "text": "Question 11 (15 marks) Use a separate writing booklet."
        }
      ]
    },
    {
      "number": "14",
      "marks": 15,
      "topic": null,
      "module": null,
      "syllabusRefs": [],
      "type": null,
      "marksPrinted": true,
      "stimulus": [],
      "text": "Question 14 (15 marks) Use a separate writing",
      "parts": [
        {
          "label": null,
          "marks": 15,
          "type": null,
          "marksPrinted": true,
          "regions": [
            {
              "page": 3,
              "bbox": [
                0.06,
                0.12167032967032967,
                0.95,
                0.13186813186813187
              ]
            }
          ],
          "markingRegions": [],
          "text": "Question 14 (15 marks) Use a separate writing"
        }
      ]
    },
    {
      "number": "13",
      "marks": 15,
      "topic": null,
      "module": null,
      "syllabusRefs": [],
      "type": null,
      "marksPrinted": true,
      "stimulus": [],
      "text": "Question 13 (15 marks) Use a separate writing booklet.",
      "parts": [
        {
          "label": null,
          "marks": 15,
          "type": null,
          "marksPrinted": true,
          "regions": [
            {
              "page": 3,
              "bbox": [
                0.06,
                0.12386813186813186,
                0.95,
                1.0
              ]
            }
          ],
          "markingRegions": [],
          "text": "Question 13 (15 marks) Use a separate writing booklet."
        }
      ]
    },
    {
      "number": "15",
      "marks": 15,
      "topic": null,
      "module": null,
      "syllabusRefs": [],
      "type": null,
      "marksPrinted": true,
      "stimulus": [],
      "text": "Question 15 (15 marks)",
      "parts": [
        {
          "label": null,
          "marks": 15,
          "type": null,
          "marksPrinted": true,
          "regions": [
            {
              "page": 4,
              "bbox": [
                0.06,
                0.11947252747252746,
                0.95,
                0.12967032967032968
              ]
            }
          ],
          "markingRegions": [],
          "text": "Question 15 (15 marks)"
        }
      ]
    },
    {
      "number": "16",
      "marks": 15,
      "topic": null,
      "module": null,
      "syllabusRefs": [],
      "type": null,
      "marksPrinted": true,
      "stimulus": [],
      "text": "Question 16 (15 marks) \u2018Use a separate writing",
      "parts": [
        {
          "label": null,
          "marks": 15,
          "type": null,
          "marksPrinted": true,
          "regions": [
            {
              "page": 4,
              "bbox": [
                0.06,
                0.12167032967032967,
                0.95,
                1.0
              ]
            }
          ],
          "markingRegions": [],
          "text": "Question 16 (15 marks) \u2018Use a separate writing"
        }
      ]
    }
  ]
}