{
  "paperId": "maths-advanced-y12-trial-sydney-boys-2012-w-sol",
  "subject": "maths-advanced",
  "source": "ocr",
  "questions": [
    {
      "number": "9",
      "marks": 1,
      "topic": null,
      "module": null,
      "syllabusRefs": [],
      "type": "mc",
      "marksPrinted": true,
      "stimulus": [],
      "text": "9. Two cards are drawn in succession from a regular pack of 52 cards. What",
      "parts": [
        {
          "label": null,
          "marks": 1,
          "type": "mc",
          "marksPrinted": true,
          "regions": [
            {
              "page": 3,
              "bbox": [
                0.06,
                0.08135508935508937,
                0.95,
                0.31157731157731156
              ]
            }
          ],
          "markingRegions": [],
          "text": "9. Two cards are drawn in succession from a regular pack of 52 cards. What"
        }
      ]
    },
    {
      "number": "10",
      "marks": 1,
      "topic": null,
      "module": null,
      "syllabusRefs": [],
      "type": "mc",
      "marksPrinted": true,
      "stimulus": [],
      "text": "10. If the 5th term and 18th term of an arithmetic series are 12 and 64 respectively,",
      "parts": [
        {
          "label": null,
          "marks": 1,
          "type": "mc",
          "marksPrinted": true,
          "regions": [
            {
              "page": 3,
              "bbox": [
                0.06,
                0.30357731157731155,
                0.95,
                1.0
              ]
            }
          ],
          "markingRegions": [],
          "text": "10. If the 5th term and 18th term of an arithmetic series are 12 and 64 respectively,"
        }
      ]
    },
    {
      "number": "8",
      "marks": 1,
      "topic": null,
      "module": null,
      "syllabusRefs": [],
      "type": "mc",
      "marksPrinted": true,
      "stimulus": [],
      "text": "8. logs 15 + log, 18 \u2014 log, 10 =",
      "parts": [
        {
          "label": null,
          "marks": 1,
          "type": "mc",
          "marksPrinted": true,
          "regions": [
            {
              "page": 14,
              "bbox": [
                0.06,
                0.5017125097125097,
                0.95,
                1.0
              ]
            }
          ],
          "markingRegions": [],
          "text": "8. logs 15 + log, 18 \u2014 log, 10 ="
        }
      ]
    },
    {
      "number": "9",
      "marks": 1,
      "topic": null,
      "module": null,
      "syllabusRefs": [],
      "type": "mc",
      "marksPrinted": true,
      "stimulus": [],
      "text": "9. Two cards sion from a regular pack of 52 cards. What",
      "parts": [
        {
          "label": null,
          "marks": 1,
          "type": "mc",
          "marksPrinted": true,
          "regions": [
            {
              "page": 15,
              "bbox": [
                0.06,
                0.08135508935508937,
                0.95,
                0.43045843045843046
              ]
            }
          ],
          "markingRegions": [],
          "text": "9. Two cards sion from a regular pack of 52 cards. What"
        }
      ]
    },
    {
      "number": "10",
      "marks": 1,
      "topic": null,
      "module": null,
      "syllabusRefs": [],
      "type": "mc",
      "marksPrinted": true,
      "stimulus": [],
      "text": "10. If the 5th term and 18th term of an arithmetic series are 12 and 64 respectively,",
      "parts": [
        {
          "label": null,
          "marks": 1,
          "type": "mc",
          "marksPrinted": true,
          "regions": [
            {
              "page": 15,
              "bbox": [
                0.06,
                0.42245843045843046,
                0.95,
                1.0
              ]
            }
          ],
          "markingRegions": [],
          "text": "10. If the 5th term and 18th term of an arithmetic series are 12 and 64 respectively,"
        },
        {
          "label": "d",
          "marks": null,
          "type": null,
          "marksPrinted": false,
          "regions": [
            {
              "page": 17,
              "bbox": [
                0.06,
                0.08135508935508937,
                0.95,
                0.578088578088578
              ]
            }
          ],
          "markingRegions": [],
          "text": "(d) The graph shows y! and y\" for the function y = f(x)"
        },
        {
          "label": "e",
          "marks": null,
          "type": null,
          "marksPrinted": false,
          "regions": [
            {
              "page": 17,
              "bbox": [
                0.06,
                0.570088578088578,
                0.95,
                1.0
              ]
            }
          ],
          "markingRegions": [],
          "text": "(e) Find [s cos (5) dr."
        },
        {
          "label": "c",
          "marks": null,
          "type": null,
          "marksPrinted": false,
          "regions": [
            {
              "page": 22,
              "bbox": [
                0.06,
                0.08135508935508937,
                0.95,
                1.0
              ]
            }
          ],
          "markingRegions": [],
          "text": "(c) A right lar cylinder of radius rem and height hem has to be"
        },
        {
          "label": "b",
          "marks": null,
          "type": null,
          "marksPrinted": false,
          "regions": [
            {
              "page": 27,
              "bbox": [
                0.06,
                0.08135508935508937,
                0.95,
                1.0
              ]
            }
          ],
          "markingRegions": [],
          "text": "(b) (i)"
        }
      ]
    }
  ]
}